{
  "id": "glassmorphism",
  "name": "Glassmorphism",
  "fit": "Frosted blur panels over rich bg; chrome/modals, not dense tables.",
  "feel": "Airy depth, modern overlay language.",
  "surfaces": "backdrop-blur cards with light borders over gradients or imagery.",
  "type": "Sans UI; avoid thin weights on glass.",
  "color": "Desaturated fills at low opacity; vivid backdrop optional.",
  "depth": "Blur + border + soft shadow.",
  "motion": "Fade and soft slide for overlays.",
  "bestFor": "Modals, nav over heroes, light dashboards.",
  "avoid": "Every card frosted; analytics tables on blur.",
  "adapt": "Limit glass to elevated surfaces; solidify reading panes.",
  "systems": "fluent-2, material-3, spectrum"
}
