{
  "id": "dark-tooling",
  "name": "Dark tooling",
  "fit": "Dark-first, monospace accents, high-contrast developer/ops tools.",
  "feel": "Technical, precise, nocturnal workspace.",
  "surfaces": "Dark canvases, dense panels, thin dividers.",
  "type": "UI sans + monospace for code, IDs, logs.",
  "color": "Dark neutrals; luminous status colors.",
  "depth": "Subtle panel lift; glowing focus optional.",
  "motion": "Fast, utilitarian.",
  "bestFor": "Devtools, observability, IDEs, infra consoles.",
  "avoid": "Pastel clay, bright marketing gradients in the core UI.",
  "adapt": "Keep dark-first and mono accents; brand the status hues.",
  "systems": "carbon, cloudscape, primer, lightning"
}
