{
  "id": "spatial-depth",
  "name": "Spatial depth",
  "fit": "Subtle layered shadows/3D accents for hierarchy without skeuomorphism.",
  "feel": "Dimensional but restrained; hierarchy through space.",
  "surfaces": "Layered sheets, soft ambient occlusion, occasional 3D accent.",
  "type": "Neutral UI sans.",
  "color": "Neutral stages; accent on primary actions.",
  "depth": "Rest / raised / overlay clearly stepped.",
  "motion": "Z-axis aware (scale/opacity).",
  "bestFor": "Modern SaaS that needs hierarchy beyond flat borders.",
  "avoid": "Full skeuomorphism or novelty 3D everywhere.",
  "adapt": "Keep elevation steps; tune shadow warmth to brand.",
  "systems": "fluent-2, material-3, spectrum, ant-design"
}
