{
  "id": "flat",
  "name": "Flat",
  "fit": "No fake depth; solid fills, simple borders; classic efficient UI.",
  "feel": "Direct, efficient, unornamented.",
  "surfaces": "Solid fills, 1px borders, no skeuomorphism.",
  "type": "Neutral UI sans throughout.",
  "color": "Semantic solids; clear states without gloss.",
  "depth": "None beyond optional hairline separators.",
  "motion": "Simple fades.",
  "bestFor": "Admin tools, forms, high-efficiency UIs.",
  "avoid": "Heavy glass, clay, ornamental gradients.",
  "adapt": "Keep flat surfaces; brand through color and type only.",
  "systems": "govuk, carbon, lightning, ant-design"
}
