{
  "id": "soft-ui",
  "name": "Soft UI (neumorphism)",
  "fit": "Extruded soft shadows; consumer/low-density only\u2014watch contrast.",
  "feel": "Tactile, soft, embossed into the canvas.",
  "surfaces": "Same-hue extrusion; dual light/dark shadows.",
  "type": "Rounded sans; medium weights for contrast.",
  "color": "Monochrome soft surfaces; accents used sparingly.",
  "depth": "Convex/concave soft shadows only.",
  "motion": "Gentle press states.",
  "bestFor": "Simple consumer controls, wellness, low-density settings.",
  "avoid": "Dense data, WCAG-critical primary actions without extra contrast.",
  "adapt": "Raise contrast on text and CTAs; keep soft only as texture.",
  "systems": "material-3, polaris"
}
