{
  "id": "editorial",
  "name": "Editorial",
  "fit": "Magazine type, display serif moments, strong typographic rhythm.",
  "feel": "Literary, composed, content-led.",
  "surfaces": "Wide measure or strong column rhythm; quiet chrome.",
  "type": "Display serif + readable sans or serif body.",
  "color": "Restrained; ink-like neutrals with one accent.",
  "depth": "Mostly flat; occasional soft card.",
  "motion": "Slow, restrained.",
  "bestFor": "Publishing, knowledge bases, content products.",
  "avoid": "Dense ops dashboards as the default home.",
  "adapt": "Keep serif moments for titles; UI chrome stays sober.",
  "systems": "primer, paste, atlassian"
}
