{
  "id": "material-tonal",
  "name": "Material tonal",
  "fit": "Tonal surfaces and seed-color harmony (Material You climate).",
  "feel": "Harmonized, adaptive, soft tonal layers.",
  "surfaces": "Tone-based containers from a seed color.",
  "type": "Product sans with clear roles (Material-like scale).",
  "color": "Dynamic tonal palette from one source hue.",
  "depth": "Tonal elevation more than heavy shadow.",
  "motion": "Standard emphasized easing.",
  "bestFor": "Cross-platform apps, consumer Android-adjacent products.",
  "avoid": "Arbitrary unrelated accent rainbows.",
  "adapt": "Pick a seed color for this brand; keep tonal roles.",
  "systems": "material-3"
}
