{
  "id": "neo-brutalism",
  "name": "Neo-brutalism",
  "fit": "Hard borders, high contrast, raw/bold marketing-adjacent product.",
  "feel": "Loud, honest, graphic, anti-polish.",
  "surfaces": "Thick black borders, hard offsets, flat fills.",
  "type": "Bold display or grotesque; high weight contrast.",
  "color": "Flat primaries; stark black/white structure.",
  "depth": "Hard drop shadows, no blur.",
  "motion": "Snappy or none.",
  "bestFor": "Marketing-led products, creative tools, bold startups.",
  "avoid": "Subtle enterprise chrome, soft accessibility-safe pastels only.",
  "adapt": "Keep hard borders and offset shadows; swap the primary fill.",
  "systems": "gestalt, ant-design"
}
